列1,列2,列3,列4,Param1,Param2,Pram3
4日目,少女リーザ,村人,どうしよう、垂れ流すべきか真面目に発言まとめるべきか悩み中。,,,
4日目,少女リーザ,村人,判定は確認…,,,
4日目,少女リーザ,村人,というか、アルビン狼もあるかも？,Estimate,Wolf,
4日目,少女リーザ,村人,ってお出かけ中ふと思ったのが無駄になった残念。,,,
4日目,少女リーザ,村人,襲撃考察は>>704で。,,,
4日目,少女リーザ,村人,書くかどうか迷ってたこと含め、思ってた事を全部言われたのでこれでいいや感。,,,
4日目,少女リーザ,村人,んー、クララさんのヤコブさん今日吊るって提案はヨアヒムさんが客観的に狩人っぽいって話を除けば、ありだとは思うんだけど、…,,,
4日目,少女リーザ,村人,つまり、今日吊っても結局ヤコブさんの判定見れない可能性あるので推し辛いなぁ。,,,
4日目,少女リーザ,村人,ディーターさんは、昨日の考察でヨアヒムさん考察の比重というか熱心だった気がして、それで襲うとか狼だとしたら丁寧だなぁって思った。,,,
4日目,少女リーザ,村人,ニコラスさんは私的にトーマスさんより白い位置。,,,
4日目,少女リーザ,村人,後は何かあったかな。,,,
4日目,少女リーザ,村人,でもまあ、今日ヤコブさん吊る利点は、もう１人狩候補を襲ってリスクが今日より低い状態でカタリナさんを襲撃→霊判定隠しをされるのだるいって考えをすれば、ありかもにゃーとは思った。,,,
4日目,少女リーザ,村人,とりあえずヤコブさんの発言次第かな。,,,
4日目,少女リーザ,村人,うーん。,,,
4日目,少女リーザ,村人,アルビン狼だったらトーマスだろこれ！,Estimate,Wolf,
4日目,少女リーザ,村人,とか昨日の真狼狼って話からお出かけ中思いついてにやにやしてたのに、違ったから消去法でペーターかクララかなぁ。,,,
4日目,少女リーザ,村人,って感じ。,,,
4日目,少女リーザ,村人,ペーターは>>594の「,,,
4日目,少女リーザ,村人,まさかまさかの狂人襲撃！？,,,
4日目,少女リーザ,村人,」が良くわからにゃ。,,,
4日目,少女リーザ,村人,黒白白で判定割れてて、白出し占い師が襲われてたら普通自分の考察とかすっ飛ばして真だと思うような…。,,,
4日目,少女リーザ,村人,ペーターの考察見てると、ヨアヒムさん襲撃はディーターさんよりはしそう。,,,
4日目,少女リーザ,村人,みたいな感じ。,,,
4日目,少女リーザ,村人,どうゆう比較だよって突っ込みは受け付けませんっ！,,,
4日目,少女リーザ,村人,まさかまさかの狂人襲撃って何だ。,,,
4日目,少女リーザ,村人,コピペみすですね。,,,
4日目,少女リーザ,村人,ペーターは>>628もちょっと気になったり。,,,
4日目,少女リーザ,村人,直接やりとりしてた私とかクララさんが言うのはありだと思うんだけど、なんだかちょっともんにゃり。,,,
4日目,少女リーザ,村人,とまあ、黒っぽいかなーと思ったのはこの辺りかな？,,,
4日目,少女リーザ,村人,あ、あと今日の第一声>>686も、もう少し驚きないのかなとか。,,,
4日目,少女リーザ,村人,クララさんは、なんだかなー。,,,
4日目,少女リーザ,村人,狼でも変わらず考察とか発言を高水準でできそうなので、白要素と判断し辛いのが大変にゃ。,,,
4日目,少女リーザ,村人,あーでも>>703の議題出しの注釈っぽいのが狼だとしたら細かいかな…。,,,
4日目,少女リーザ,村人,あと>>704をヨアヒムさん狩人だと思って襲って言うってのは、ちょっとさすがに凄いなとは思う。,,,
4日目,少女リーザ,村人,→白要素かなぁ。,,,
4日目,少女リーザ,村人,流し読みだったのがばれる。,,,
4日目,少女リーザ,村人,>>709で今日もまた灰襲撃あったらって書いてあるし略。,,,
4日目,司書クララ,村人,■２．,,,
4日目,司書クララ,村人,灰考察GS[○妙≧旅≧樵＞年＞＞者＞＞農●]妙＞修狼から、初日の真予想は若干気がかり点だけど、むしろ妙黒なら仲間には厳しい人だと思う。,Opinion,Diviner,
4日目,司書クララ,村人,兵庇いや商責め考えても、色見えてない故の行動に思う。,,,
4日目,司書クララ,村人,農黒時は2d●農希望もあって、さらに白い。,Estimate,,
4日目,司書クララ,村人,騙りラインつけて、灰同士では切りとか、なくはないけど微妙。,,,
4日目,司書クララ,村人,昨日灰考察がはっきり出てないのはマイナス。,,,
4日目,司書クララ,村人,灰白くなると考察困るっていうのは狼要素だし。,,,
4日目,司書クララ,村人,積極的に白つけてる,,,
4日目,司書クララ,村人,動きから、黒だと矛盾行動。,,,
4日目,司書クララ,村人,寡黙白よりは、多弁白が好きって事で最白位置。,,,
4日目,司書クララ,村人,農白の場合は要注意。,,,
4日目,司書クララ,村人,旅＞不慣れ感がすとんと嵌ったから、するっと疑惑とけた人。,,,
4日目,司書クララ,村人,多弁疑いも、その辺の感情でしょうし、SGにする動きとしては微妙。,,,
4日目,司書クララ,村人,考察に不安感はあるけど、考えて判断出してるのは取れたし、狼なら、もう少し先見て判断動く。,,,
4日目,司書クララ,村人,そう言う意味でも白でいいと思う。,,,
4日目,司書クララ,村人,樵＞昨日はちょっと不安定。,,,
4日目,司書クララ,村人,ただまぁ、状況難しくなって迷い出てるだ,,,
4日目,司書クララ,村人,けかな。,,,
4日目,司書クララ,村人,白さとしては若干落ちた。,,,
4日目,司書クララ,村人,とはいえ、考え素直に見えるし、流されてるんじゃ？,,,
4日目,司書クララ,村人,って振り返るのも、村感情。,,,
4日目,司書クララ,村人,寡黙狼はいるけど、修の樵考察はSG感。,,,
4日目,司書クララ,村人,ここも白で良さげ。,,,
4日目,司書クララ,村人,年＞考察、思考がするっと入る。,,,
4日目,司書クララ,村人,たぶん時間的な一致もあると思うけど。,,,
4日目,司書クララ,村人,他視点だと、書年が警戒されてるんだろうなぁって感じ。,,,
4日目,司書クララ,村人,考え似すぎｗ兵吊りへの意欲と修の年灰考察>>438が首かしげなこと。,,,
4日目,司書クララ,村人,>>413とあっての>>415▽者がよくわから,,,
4日目,司書クララ,村人,ないのが、気がかりかな。,,,
4日目,司書クララ,村人,まぁ、白だと思ってる。,,,
4日目,司書クララ,村人,者＞ごめん、消去法。,,,
4日目,司書クララ,村人,他灰より白さが取りきれないのと、印象薄さ気にしてるのが、何気にこうして黒位置されるのを恐れた感。,,,
4日目,司書クララ,村人,あとは昨日の「占至上主義」発言かな。,,,
4日目,司書クララ,村人,襲撃されない理由付けっぽさ受ける。,,,
4日目,司書クララ,村人,灰考察はきちんと見てる感だし、LW違和感はないかな、とかそんな感じ。,,,
4日目,司書クララ,村人,ここはあんまり自信ないなぁ。,,,
4日目,司書クララ,村人,修ライン的には、あまり触れられないようにしてる？,questtion,fact_check,
4日目,司書クララ,村人,って感じではある。,,,
4日目,司書クララ,村人,農＞最黒。,Estimate,Wolf,
4日目,司書クララ,村人,ほぼここ狼で思考固まってる。,,,
4日目,司書クララ,村人,>>273修非狼援護。,,,
4日目,司書クララ,村人,>>320●兵への疑い。,Vote,Diviner,
4日目,司書クララ,村人,>>497旅の修吊り見ての過剰反応。,,,
4日目,司書クララ,村人,兵黒なら、しつつ>>510兵白の場合、とダブルスタンダードな視点。,,,
4日目,司書クララ,村人,>>536も同じく。,,,
4日目,司書クララ,村人,兵白知ってて疑惑撒いてる動き。,,,
4日目,司書クララ,村人,1d占い挙げて疑ってたのに、ヤコからはシモン考察出てない時点で怪しいし>>538「あと、シモンと占い師」って考察優先順位明らかに変。,,,
4日目,司書クララ,村人,村側で、新たに情報増えての考察,,,
4日目,司書クララ,村人,流れじゃない。,,,
4日目,司書クララ,村人,>>550はツッコミ済み。,,,
4日目,司書クララ,村人,この日この発言だけで考察なしも、灰白さから身動きとりにくくて、迷って出れなくなった狼的行動。,,,
4日目,司書クララ,村人,修ラインもいろいろあり。,,,
4日目,司書クララ,村人,追加で、修>>515の農多数票でのヨア占い希望待ちとか、表の割り振りの微妙さ。,,,
4日目,司書クララ,村人,なんで自分が占う対象希望のほうが○扱いなんよｗ お互いに本気で疑いあってる感じがないのも、やっぱり両狼に見える。,,,
4日目,司書クララ,村人,白だったらほんと困るけど、思考リセット出来なそう。,,,
4日目,旅人ニコラス,村人,ヤコブよりペーターのが怪しい…,,,
4日目,旅人ニコラス,村人,修司が農吊ると言ってる。,,,
4日目,旅人ニコラス,村人,実際どうするのか判らないけど、ヤコブよりペーター、ペーターよりクララ というGSになってきた。,,,
4日目,旅人ニコラス,村人,修→農の「おしゃれ」発言はちょっと謎だった。,,,
4日目,旅人ニコラス,村人,それが狼同士のつるみなのかは首傾げるしかない。,,,
4日目,旅人ニコラス,村人,黒には結び付けない…,,,
4日目,旅人ニコラス,村人,ヤコたんが狼だったら良い流れなんだけどな…,,,
4日目,旅人ニコラス,村人,ヤコたんの反論を待つ。,,,
4日目,旅人ニコラス,村人,リーザとクララが狼だったら、村側かなり厳しいと思う。,,,
4日目,旅人ニコラス,村人,個人的にリーザの意見に同意だけど、吊希望は最後まで伏せとく。,,,
4日目,少女リーザ,村人,読み返してみて思ったけど、ディーターさんは考察をびしっと出してたのにヤコブさんに対して以外の結論（白視、黒視のこと）を書いてないのが気になったっ！,,,
4日目,少女リーザ,村人,よく言えば慎重なんだけど、悪く言うと狼っぽいかな？,Estimate,Wolf,
4日目,少女リーザ,村人,って感じ。…,,,
4日目,少女リーザ,村人,ってあれ、読み返してたんだけどペーターの言う、>>594「前日にオットー狂人予想してるのに」ってどこだろ。,,,
4日目,少女リーザ,村人,読み返したけど発見できなかった。,,,
4日目,少女リーザ,村人,というかディーターさんと間違ってたりしない？,,,
4日目,木こりトーマス,村人,おそようございます。,,,
4日目,木こりトーマス,村人,アルビン、最後まで狂を貫いたのね…。,,,
4日目,木こりトーマス,村人,ヨアヒムの襲撃は意外すぎて色々と考えさせられます。,,,
4日目,木こりトーマス,村人,これは狼陣営からの貴重な情報提供とも言えるかも。,,,
4日目,少女リーザ,村人,私、読み返し過ぎ。,,,
4日目,少女リーザ,村人,まあいいや、うん。,,,
4日目,少女リーザ,村人,というわけで、>>719とは矛盾するんだけどディーター>>470みたいに、「俺はこの持論なんだぜ」って空気を出して珍しい意見出して偽視してたのに、狂人ＣＯっぽいアルビンの発言見て、狂人だと思う>>>589がちょっと不思議。,,,
4日目,少女リーザ,村人,>>612で回答してるけど、ちょっとここは意識漏れをごまかした感がして黒い。,,,
4日目,少女リーザ,村人,トーマスさん＞おそよう。,,,
4日目,少女リーザ,村人,私は眠いにゃ。,,,
4日目,木こりトーマス,村人,□３．,,,
4日目,木こりトーマス,村人,襲撃考察狩狙い以外ないでしょう。,,,
4日目,木こりトーマス,村人,でなければ無駄に灰を狭めてる。,,,
4日目,木こりトーマス,村人,クララ>>675で黒寄り視され、3dに2発言しかしていない。,,,
4日目,木こりトーマス,村人,なのに襲われた。,,,
4日目,木こりトーマス,村人,これは狼からはよほど狩視されていたと思われる。,,,
4日目,木こりトーマス,村人,それも2dの時点から。,,,
4日目,木こりトーマス,村人,ということは占襲撃は真を見抜いてた、って尼狼確定だからそうですね。,,,
4日目,木こりトーマス,村人,クララ>>704「2dの狩人地雷の話などに関心見えた」はどうだろう？,,,
4日目,木こりトーマス,村人,「狩地雷」クララ>>342が初出でヨアヒム>>344で否定してる。,,,
4日目,木こりトーマス,村人,ヨアヒムの狩要素はあまり感じられない。,,,
4日目,木こりトーマス,村人,むしろ3dの一連の「占至上主義発言」の方が見ていてヒヤヒヤした。,,,
4日目,木こりトーマス,村人,これにはヨアヒムは絡んでいない。,,,
4日目,木こりトーマス,村人,村視点から見ると何ともバランスが悪いように感じるのですが…。,,,
4日目,木こりトーマス,村人,アルビン>>200でニコラスが来ていないことに気づいてない件は狂確定したため赤会話疑惑は晴れましたね。,,,
4日目,木こりトーマス,村人,ということでニコラスを白寄りに認識修正。,,,
4日目,木こりトーマス,村人,狩考察も含め3d時点でヨアヒムはクララ、リーザ、ディーターより優先して襲いたい先とは思えないです。,,,
4日目,木こりトーマス,村人,ので、ぶっちゃけこの中にLWがいると考えています。,,,
4日目,少女リーザ,村人,まとめると◇書＞旅＞樵書＞年＞者＞農◆かな、うん。,Information,,
4日目,少女リーザ,村人,クララさんが２つあるけど、発言だけ見れば最白位置で襲撃されてないって事実を黒要素換算するとこんな感じ、みたいなノリ。,,,
4日目,少女リーザ,村人,ただ明日真剣にカタリナさん強襲→通るとかだと、ヨアヒムさん襲撃は狩人狙いだったんだなー！,,,
4日目,少女リーザ,村人,って感じなので、やっぱり最白位置でいいんじゃないかな？,,,
4日目,少女リーザ,村人,しつこいけど私の非狩発言じゃないよっ。,,,
4日目,少女リーザ,村人,＠１０,,,
4日目,木こりトーマス,村人,あーでもヨアヒム2d時点で狼とは違った意味での俯瞰視点っぽさが狩要素に見えるのかも。,,,
4日目,木こりトーマス,村人,とはいえ3dを考慮するとそこまで決め打てないような気がする。,,,
4日目,木こりトーマス,村人,ん、あれ？,,,
4日目,木こりトーマス,村人,まだ尼真の可能性は残ってるんですかね？,questtion,fact_check,
4日目,木こりトーマス,村人,霊判定が効くうちにヤコブ吊り…,,,
4日目,木こりトーマス,村人,でも霊判定前のヤコブ>>699「アルビン狼フリーデル狂人で」が村視点っぽい。,,,
4日目,木こりトーマス,村人,狼なら間違えなさそう。,,,
4日目,木こりトーマス,村人,手数的に間に合うのかな？,,,
4日目,木こりトーマス,村人,ヤコブ白なら7→5で票操作→負けになりそうで恐い。,,,
4日目,木こりトーマス,村人,ここは確実に狼を減らしたい【▼フリーデルにセット】しました。,Vote,Diviner,
4日目,木こりトーマス,村人,狩潜伏してると信じてる！,,,
4日目,木こりトーマス,村人,（非狩発言じゃないよっ）,,,
4日目,木こりトーマス,村人,クララ、決め打ちよりもその場の状況で判断している印象。,,,
4日目,木こりトーマス,村人,そこはスキルの高さゆえとだろうけど。,,,
4日目,木こりトーマス,村人,思い込みや決め打ちから考察する方が村っぽいと考えるとリーザの方が白く見える。,,,
4日目,木こりトーマス,村人,ミスリード要素があるとしたらヤコブ吊りの件。,,,
4日目,木こりトーマス,村人,クララ−ニコラスのラインはあり得そう。,,,
4日目,木こりトーマス,村人,ところでヨアヒム襲撃に「狩狙い」以外の発想ってあり得ないんじゃないかと思う。,,,
4日目,木こりトーマス,村人,狼の襲撃優先は能力者が基本でしょう。,,,
4日目,木こりトーマス,村人,★リーザ、狩狙いじゃないとしたら何だと思ってました？,questtion,action,
4日目,司書クララ,村人,ただいま。,,,
4日目,司書クララ,村人,樵>>740 修真は捨てていいよ。,,,
4日目,司書クララ,村人,あと、それ、ただの非ライン見せ掛けだと思う。,,,
4日目,司書クララ,村人,根拠はシスターの判定前の考察連投。,,,
4日目,司書クララ,村人,★シスター、霊判定で修狼バレするのに、なんであんな考察出したんだと思う？,questtion,action,
4日目,司書クララ,村人,その上で、判定見ればわかることを、あのタイミングでヤコが言うのは、本当に村視点だと思うの？,,,
4日目,司書クララ,村人,★>>740書ー旅ラインって、何故に？,questtion,action,
4日目,司書クララ,村人,どちらかといえば意見対立気味なんだけど。,,,
4日目,少女リーザ,村人,☆トーマス>>741＞今日のヨアヒム襲撃見た瞬間は首かしげた。,,,
4日目,少女リーザ,村人,昨日の発言数見てもう１回首傾げた←２発言だったのでで、落ち着いて考えると狩人狙いなんだろうなって思った。,,,
4日目,少女リーザ,村人,みたいな感じ、かな。,,,
4日目,少女リーザ,村人,でも、スキル予想とかで潜伏狼像予想されるだろうし、単純に白い位置襲ったほうがいいと思ってたので意外だったよ。,,,
4日目,少女リーザ,村人,もう少し言いたい事もあるんだけど、今ぶっちゃけると非狩or狩人が全力で透けるのでまた今度っ！,,,
4日目,司書クララ,村人,あとねー。,,,
4日目,司書クララ,村人,狩生存してても今日襲われたら一緒なのわかってる？,questtion,fact_check,
4日目,司書クララ,村人,そんで、明日ならまたシスター吊り確定人数あるの。,,,
4日目,司書クララ,村人,7人だから、狼３生存でも多数決勝てるから。,,,
4日目,司書クララ,村人,今日もういちど灰襲撃があって狩人襲われたら、霊判定は残せないの。,,,
4日目,司書クララ,村人,今日の吊りでシスター黒見ても、何の情報にもならないでしょうに。,,,
4日目,司書クララ,村人,明日１狼減った。,,,
4日目,司書クララ,村人,じゃ、灰の狼探そうか、ってところで何を持って探すの？,,,
4日目,司書クララ,村人,私は手探りより、何か一つでもはっきりした確定情報ほしいよ,,,
4日目,少女リーザ,村人,クララ>>744＞うん、まあその意見わかるけどヤコブの発言をとりあえず見たかった。,,,
4日目,少女リーザ,村人,ヤコブ発言増えなかったら私は▼ヤコブで揃えるよ。,Vote,Execution,
4日目,少女リーザ,村人,増えたら見て考える。,,,
4日目,少女リーザ,村人,あと、明日のフリーデル吊りはさすがにフリーデル確定狼だし、そこで誰か居なくて票数足りないって事になるなら最初からこの村は勝てない村でしたって事でいいんじゃとか思ってみる。,,,
4日目,少女リーザ,村人,＞トーマスさんとニコラスさん、カタリナさんもというわけで、まだわからないけど実行する場合はヤコブが人間だったら私とクララの黒度があっぷするって事で投票あわせるのお願いしたいな。,,,
4日目,少女リーザ,村人,ペーターもだけど、ペーターはヤコブさん黒視してたはずなので大丈夫でしょう、うん。,,,
4日目,少女リーザ,村人,ちょっと２２時ころまで反応無くなり。,,,
4日目,少女リーザ,村人,＠６,,,
4日目,旅人ニコラス,村人,トーマス＜私と書とラインはナイよ。,,,
4日目,旅人ニコラス,村人,LWについてはトーマスと完全に同じ意見。,,,
4日目,旅人ニコラス,村人,私も狼先に減らしたい。,,,
4日目,旅人ニコラス,村人,クララよりリーザの方が白い。,,,
4日目,旅人ニコラス,村人,でもってリーザとクララの優しさで吊る方針と、昨日のヨアヒム襲撃とが重なって見えるなぁ。,,,
4日目,旅人ニコラス,村人,【修にセット】,Vote,Execution,
4日目,旅人ニコラス,村人,あのさ…,,,
4日目,旅人ニコラス,村人,狼さんの中で、フリデ嬢が占騙りやります、あとは任せて、って打ち合わせした残り二人は寡黙じゃない気がする。,,,
4日目,旅人ニコラス,村人,ヤコもペータも割りと寡黙。,,,
4日目,旅人ニコラス,村人,もし明日リーザやクララやディーターが襲われたら、自分が二度目の間違いを犯したことになるけど。,,,
4日目,旅人ニコラス,村人,そうなるだろうか？,,,
4日目,旅人ニコラス,村人,（苦笑）なる気がしない。,,,
4日目,農夫ヤコブ,人狼,とりあえずただいまーだ。,,,
4日目,農夫ヤコブ,人狼,サブ箱奪取できたので昨日の分の考察。,,,
4日目,農夫ヤコブ,人狼,クララ>>567おいらの二日目のGSは妙、年：シモン判定見て決めたい、旅：わけわかめ、青：ざっとしかよんでないすまね◇者＞司＞樵＞兵◆にしたと思うだ。,,,
4日目,農夫ヤコブ,人狼,昨日の▼はシモン吊りかニコラス吊りかぎりぎりで迷ったべ。,,,
4日目,農夫ヤコブ,人狼,で、ぎりぎりでニコラスにしてみたんだけど時間的に多分反映されてなかったと思うだ。,,,
4日目,農夫ヤコブ,人狼,クララ>>566普通ステルス狼なら「議論リードしてる相手に目をつけられたく」ないと思うべ…,,,
4日目,農夫ヤコブ,人狼,リーザ>>575☆オイラ今までオール鳩なんだけど。,,,
4日目,農夫ヤコブ,人狼,▼シモンか▼ニコラスか迷ってもう一回議事読みに戻ってた。,,,
4日目,農夫ヤコブ,人狼,クララ>>567、>>463ってことでわかってもらえなかったべ？,,,
4日目,農夫ヤコブ,人狼,クララは積極的に白い要素、黒い要素挙げていくタイプの様に思ったけど「人っぽい迷い」＝「>>315の≧のような要素」もあるからGS出してくれれば狼なら無理やり感が出るし、人ならかなり白要素拾えるなぁと思っていってたんだべ。,,,
4日目,農夫ヤコブ,人狼,ディーター☆>>604アルビンの卑怯要素のところがわからんから、アルビンの正体の結論が狼≧真≧狂になるのがわかんね,,,
4日目,農夫ヤコブ,人狼,リーザ★>>655の意味がわからないだよ…,ans,action,
4日目,農夫ヤコブ,人狼,フリーデル>>660なんでもいいけど挑発はよくないだよ。,,,
4日目,農夫ヤコブ,人狼,発言時間で考察するならリアル事情も察してくれろー。,,,
4日目,農夫ヤコブ,人狼,４時寝７時おきじゃあ二度寝もするべ。,,,
4日目,農夫ヤコブ,人狼,ニコラスの>>611の意味がトーマスの>>665でやっとわかった。,,,
4日目,農夫ヤコブ,人狼,トーマス☆>>669上：素白と寡黙って別に矛盾しないと思うっぺ？,,,
4日目,農夫ヤコブ,人狼,下：オットー狼予想だったべさ。,,,
4日目,農夫ヤコブ,人狼,だから襲撃視したことに驚いた。,,,
4日目,少年ペーター,狩人,|<ただーまー書いたよーとりあえず第一前提として、【フリーデルが黒は確定ってことを確認するよー。】,Estimate,Wolf,
4日目,少年ペーター,狩人,■１．,,,
4日目,少年ペーター,狩人,灰考察[農]…,,,
4日目,少年ペーター,狩人,みんなから真っ黒黒助第一号。,,,
4日目,少年ペーター,狩人,まあ。,,,
4日目,少年ペーター,狩人,今までの考察的には黒いと思うよー。,,,
4日目,少年ペーター,狩人,今日お久しぶりな発言だったけどまだ白さは垣間見えてないです。,,,
4日目,少年ペーター,狩人,そりゃ弁明しかしてないかられすね。,,,
